{
  "schema_version": "codex-surface-search-ledger/v0.1",
  "atlas_id": "__ATLAS_ID__",
  "as_of": "__EVIDENCE_CUTOFF__",
  "coverage_state": "planned",
  "planned_source_classes": [],
  "sources": [],
  "counts": {
    "raw_records": 0,
    "duplicate_records": 0,
    "normalized_discovered_entities": 0,
    "surface_targets": 0,
    "excluded_from_surface_universe": 0,
    "unresolved_records": 0
  },
  "limitations": []
}
